<?xml version="1.0" encoding="UTF-8" standalone="no"?>
<ts:token xmlns:ts="http://tokenscript.org/2022/09/tokenscript"
		  xmlns:xml="http://www.w3.org/XML/1998/namespace"
		  xsi:schemaLocation="http://tokenscript.org/2022/09/tokenscript http://tokenscript.org/2022/09/tokenscript.xsd"
		  xmlns:xsi="http://www.w3.org/2001/XMLSchema-instance"
		  xmlns:ethereum="urn:ethereum:constantinople"
		  name="entry-token">
	<ts:label>
		<ts:plurals xml:lang="en">
			<ts:string quantity="one">entry-token Token</ts:string>
			<ts:string quantity="other">entry-token Tokens</ts:string>
		</ts:plurals>
	</ts:label>
	<ts:meta>
		<ts:description xml:lang="en">entry token</ts:description>
		<ts:aboutUrl xml:lang="en">https://expansionpunks.com/</ts:aboutUrl>
		<ts:iconUrl xml:lang="en">https://expansionpunks.com/image</ts:iconUrl>
	</ts:meta>
	<ts:contract interface="erc721" name="Token">
		<ts:address network="1">0x0d0167a823c6619d430b1a96ad85b888bcf97c37</ts:address>
	</ts:contract>
	<ts:origins>
		<!-- Define the contract which holds the token that the user will use -->
		<ts:ethereum contract="Token"/>
	</ts:origins>

	<ts:cards>
		<ts:viewContent name="common" xmlns="http://www.w3.org/1999/xhtml">
			<ts:include type="html" src="./dist/index.html"/>
			<ts:include type="css" src="./src/styles.css"/>
		</ts:viewContent>

		<ts:card type="token" name="Info" origins="Token">
			<ts:label>
				<ts:string xml:lang="en">Info</ts:string>
			</ts:label>
			<ts:view xmlns="http://www.w3.org/1999/xhtml" xml:lang="en" urlFragment="info">
				<ts:viewContent name="common"/>
			</ts:view>
		</ts:card>

		<ts:card type="action" name="OpenGate">
			<ts:label>
				<ts:string xml:lang="en">Open Gate</ts:string>
			</ts:label>
			<ts:view xmlns="http://www.w3.org/1999/xhtml" xml:lang="en" urlFragment="open">
				<ts:viewContent name="common"/>
			</ts:view>
		</ts:card>

	</ts:cards>

</ts:token>
