<?xml version="1.0" encoding="UTF-8"?>
<!DOCTYPE token  [
        <!ENTITY style SYSTEM "shared.css">
        <!ENTITY about.en SYSTEM "about.en.shtml">
        ]>
<ts:token xmlns:ts="http://tokenscript.org/2020/06/tokenscript"
          xmlns:ethereum="urn:ethereum:constantinople"
          xmlns:xhtml="http://www.w3.org/1999/xhtml"
          xmlns:xml="http://www.w3.org/XML/1998/namespace"
          xsi:schemaLocation="http://tokenscript.org/2020/06/tokenscript http://tokenscript.org/2020/06/tokenscript.xsd"
          xmlns:xsi="http://www.w3.org/2001/XMLSchema-instance"
          name="daiPool"
>
    <ts:label>
        <ts:string xml:lang="en">Uniswap DAI V1</ts:string>
    </ts:label>
    <ts:contract interface="erc20" name="uniswap">
        <ts:address network="1">0x2a1530C4C41db0B0b2bB646CB5Eb1A67b7158667</ts:address>     <!--mainnet-->
    </ts:contract>

    <ts:origins>
        <!-- Define the contract which holds the token that the user will use -->
        <ts:ethereum contract="uniswap"/> <!-- as above ts:contract name -->
    </ts:origins>

    <ts:cards>
        <ts:card type="action" name="about">
            <ts:label>
                <ts:string xml:lang="en">About</ts:string>
            </ts:label>
            <ts:view xmlns="http://www.w3.org/1999/xhtml" xml:lang="en">
                <style type="text/css">&style;</style>
                <body>&about.en;</body>
            </ts:view>
        </ts:card>
    </ts:cards>
        <!-- placeholder for future functions -->
        <ts:attribute name="symbol">
            <ts:type><ts:syntax>1.3.6.1.4.1.1466.115.121.1.26</ts:syntax></ts:type>
            <ts:origins>
                <ethereum:call function="symbol" as="utf8">
                </ethereum:call>
            </ts:origins>
        </ts:attribute>
</ts:token>
