<?xml version="1.0" encoding="UTF-8"?>
<!DOCTYPE token  [
        <!ENTITY style SYSTEM "shared.css">
        <!ENTITY mint.en SYSTEM "supply.en.js">
        <!ENTITY redeem.en SYSTEM "withdraw.en.js">
        ]>
<ts:token xmlns:ts="http://tokenscript.org/2020/06/tokenscript"
          xmlns:ethereum="urn:ethereum:constantinople"
          xmlns:xhtml="http://www.w3.org/1999/xhtml"
          xmlns:xml="http://www.w3.org/XML/1998/namespace"
          xsi:schemaLocation="http://tokenscript.org/2020/06/tokenscript http://tokenscript.org/2020/06/tokenscript.xsd"
          xmlns:xsi="http://www.w3.org/2001/XMLSchema-instance"
          name="cETH"
>
<ts:label>
    <ts:string xml:lang="en">cETH</ts:string>
</ts:label>
<ts:contract name="cETH" interface="erc20">
    <ts:address network="1">0x4ddc2d193948926d02f9b1fe9e1daa0718270ed5</ts:address>
</ts:contract>
<ts:origins>
    <ts:ethereum contract="cETH"/>
</ts:origins>

<ts:cards>
    <ts:card type="action" name="deposit">
        <ts:label>
            <ts:string xml:lang="en">Deposit</ts:string>
        </ts:label>
        <ts:attribute name="mintAmount">
            <ts:type><ts:syntax>1.3.6.1.4.1.1466.115.121.1.36</ts:syntax></ts:type>
            <ts:label>
                <ts:string xml:lang="en">Amount to supply</ts:string>
            </ts:label>
            <ts:origins>
                <!-- e18 is a hard coded multiplier.
                rationale for hardcoding: avoiding over-design  -->
                <ts:user-entry as="e18"/>
            </ts:origins>
        </ts:attribute>
        <ts:transaction>
            <ethereum:transaction function="mint" contract="cETH" as="uint">
                <ts:data>
                    <ts:uint256 ref="mintAmount"/>
                </ts:data>
            </ethereum:transaction>
        </ts:transaction>
        <ts:view xml:lang="en">
            <xhtml:style type="text/css">&style;</xhtml:style>
            <xhtml:script type="text/javascript">&mint.en;</xhtml:script>
        </ts:view>
    </ts:card>

    <ts:card type="action" name="withdraw">
        <ts:label>
            <ts:string xml:lang="en">Withdraw</ts:string>
        </ts:label>
        <ts:attribute name="redeemAmount">
            <ts:type><ts:syntax>1.3.6.1.4.1.1466.115.121.1.36</ts:syntax></ts:type>
            <ts:label>
                <ts:string xml:lang="en">Amount to withdraw</ts:string>
            </ts:label>
            <ts:origins>
                <ts:user-entry as="e8"/>
            </ts:origins>
        </ts:attribute>
        <ts:transaction>
            <ethereum:transaction function="redeem" contract="cETH" as="uint">
                <ts:data>
                    <ts:uint256 ref="redeemAmount"/>
                </ts:data>
            </ethereum:transaction>
        </ts:transaction>
        <ts:view xml:lang="en">
            <xhtml:style type="text/css">&style;</xhtml:style>
            <xhtml:script type="text/javascript">&redeem.en;</xhtml:script>
        </ts:view>
    </ts:card>

</ts:cards>


    <!-- eth to cETH exchange rate -->
    <ts:attribute name="exchangeRate">
        <ts:type><ts:syntax>1.3.6.1.4.1.1466.115.121.1.36</ts:syntax></ts:type>
        <ts:label>
            <ts:string xml:lang="en">Exchange Rate</ts:string>
        </ts:label>
        <ts:origins>
            <ethereum:call function="exchangeRateCurrent" contract="cETH" as="uint">
            </ethereum:call>
        </ts:origins>
    </ts:attribute>

    <ts:attribute name="cTokenBalance">
        <ts:type><ts:syntax>1.3.6.1.4.1.1466.115.121.1.36</ts:syntax></ts:type>
        <ts:label>
            <ts:string xml:lang="en">Balance</ts:string>
            <ts:string xml:lang="zh">餘額</ts:string>
        </ts:label>
        <ts:origins>
            <ethereum:call function="balanceOf" contract="cETH" as="uint">
                <ts:data>
                    <ts:address ref="ownerAddress"/>
                </ts:data>
            </ethereum:call>
        </ts:origins>
    </ts:attribute>

    <ts:attribute name="supplyInterestRate">
        <ts:type><ts:syntax>1.3.6.1.4.1.1466.115.121.1.36</ts:syntax></ts:type>
        <ts:label>
            <ts:string xml:lang="en">Supply Interest Rate</ts:string>
        </ts:label>
        <ts:origins>
            <ethereum:call function="supplyRatePerBlock" contract="cETH" as="uint">
            </ethereum:call>
        </ts:origins>
    </ts:attribute>

</ts:token>
