<?xml version="1.0" encoding="UTF-8"?>
<!DOCTYPE token  [
        <!ENTITY style SYSTEM "shared.css">
        <!ENTITY mint.en SYSTEM "supply.en.js">
        <!ENTITY redeem.en SYSTEM "withdraw.en.js">
        <!ENTITY enable.en SYSTEM "enable.en.js">
        ]>
<ts:token xmlns:ts="http://tokenscript.org/2020/06/tokenscript"
          xmlns:ethereum="urn:ethereum:constantinople"
          xmlns:xhtml="http://www.w3.org/1999/xhtml"
          xmlns:xml="http://www.w3.org/XML/1998/namespace"
          xsi:schemaLocation="http://tokenscript.org/2020/06/tokenscript http://tokenscript.org/2020/06/tokenscript.xsd"
          xmlns:xsi="http://www.w3.org/2001/XMLSchema-instance"
          name="cREP"
>
<ts:label>
    <ts:string xml:lang="en">cREP</ts:string>
</ts:label>
<ts:contract name="cREP" interface="erc20">
    <ts:address network="1">0x158079ee67fce2f58472a96584a73c7ab9ac95c1</ts:address>
</ts:contract>
<ts:contract name="REP" interface="erc20">
    <ts:address network="1">0xE94327D07Fc17907b4DB788E5aDf2ed424adDff6</ts:address>
</ts:contract>
<ts:origins>
    <ts:ethereum contract="cREP"/>
</ts:origins>
    <ts:selection name="enabled" filter="allowance>0">
        <ts:label>
            <ts:string xml:lang="en">contract already enabled</ts:string>
        </ts:label>
    </ts:selection>
    <ts:selection name="notEnabled" filter="allowance=0">
        <ts:label>
            <ts:string xml:lang="en">contract not enabled</ts:string>
        </ts:label>
    </ts:selection>
    <ts:cards>
        <!-- Do not show this card if the token contract is already enabled -->
    <ts:card type="action" exclude="enabled" name="enable">
        <ts:label>
            <ts:string xml:lang="en">Enable</ts:string>
        </ts:label>
        <ts:transaction>
            <ethereum:transaction function="approve" contract="REP" as="bool">
                <ts:data>
                    <ts:address>0x158079ee67fce2f58472a96584a73c7ab9ac95c1</ts:address>
                    <ts:uint256>115792089237316195423570985008687907853269984665640564039457584007913129639935</ts:uint256>
                </ts:data>
            </ethereum:transaction>
        </ts:transaction>
        <ts:view xml:lang="en">
            <xhtml:style type="text/css">&style;</xhtml:style>
            <xhtml:script type="text/javascript">&enable.en;</xhtml:script>
        </ts:view>
    </ts:card>

    <ts:card type="action" exclude="notEnabled" name="deposit">
        <ts:label>
            <ts:string xml:lang="en">Deposit</ts:string>
        </ts:label>
        <ts:attribute name="mintAmount">
            <ts:type><ts:syntax>1.3.6.1.4.1.1466.115.121.1.36</ts:syntax></ts:type>
            <ts:label>
                <ts:string xml:lang="en">Amount to supply</ts:string>
            </ts:label>
            <ts:origins>
                <!-- e18 is a hard coded multiplier.
                rationale for hardcoding: avoiding over-design  -->
                <ts:user-entry as="e18"/>
            </ts:origins>
        </ts:attribute>
        <ts:transaction>
            <ethereum:transaction function="mint" contract="cREP" as="uint">
                <ts:data>
                    <ts:uint256 ref="mintAmount"/>
                </ts:data>
            </ethereum:transaction>
        </ts:transaction>
        <ts:view xml:lang="en">
            <xhtml:style type="text/css">&style;</xhtml:style>
            <xhtml:script type="text/javascript">&mint.en;</xhtml:script>
        </ts:view>
    </ts:card>

    <ts:card type="action" exclude="notEnabled" name="withdraw">
        <ts:label>
            <ts:string xml:lang="en">Withdraw</ts:string>
        </ts:label>
        <ts:attribute name="redeemAmount">
            <ts:type><ts:syntax>1.3.6.1.4.1.1466.115.121.1.36</ts:syntax></ts:type>
            <ts:label>
                <ts:string xml:lang="en">Amount to withdraw</ts:string>
            </ts:label>
            <ts:origins>
                <ts:user-entry as="e8"/>
            </ts:origins>
        </ts:attribute>
        <ts:transaction>
            <ethereum:transaction function="redeem" contract="cREP" as="uint">
                <ts:data>
                    <ts:uint256 ref="redeemAmount"/>
                </ts:data>
            </ethereum:transaction>
        </ts:transaction>
        <ts:view xml:lang="en">
            <xhtml:style type="text/css">&style;</xhtml:style>
            <xhtml:script type="text/javascript">&redeem.en;</xhtml:script>
        </ts:view>
    </ts:card>

</ts:cards>


    <ts:attribute name="allowance">
        <ts:type><ts:syntax>1.3.6.1.4.1.1466.115.121.1.36</ts:syntax></ts:type>
        <ts:origins>
            <ethereum:call function="allowance" contract="REP" as="uint">
                <ts:data>
                    <ts:address ref="ownerAddress"/>
                    <ts:address>0x158079ee67fce2f58472a96584a73c7ab9ac95c1</ts:address>
                </ts:data>
            </ethereum:call>
        </ts:origins>
    </ts:attribute>

    <!-- your balance in REP (not compound REP) -->
    <ts:attribute name="tokenBalance">
        <ts:type><ts:syntax>1.3.6.1.4.1.1466.115.121.1.36</ts:syntax></ts:type>
        <ts:label>
            <ts:string xml:lang="en">Balance</ts:string>
            <ts:string xml:lang="zh">餘額</ts:string>
        </ts:label>
        <ts:origins>
            <ethereum:call function="balanceOf" contract="REP" as="uint">
                <ts:data>
                    <ts:address ref="ownerAddress"/>
                </ts:data>
            </ethereum:call>
        </ts:origins>
    </ts:attribute>

    <!-- REP to cREP exchange rate -->
    <ts:attribute name="exchangeRate">
        <ts:type><ts:syntax>1.3.6.1.4.1.1466.115.121.1.36</ts:syntax></ts:type>
        <ts:label>
            <ts:string xml:lang="en">Exchange Rate</ts:string>
        </ts:label>
        <ts:origins>
            <ethereum:call function="exchangeRateCurrent" contract="cREP" as="uint">
            </ethereum:call>
        </ts:origins>
    </ts:attribute>

    <ts:attribute name="cTokenBalance">
        <ts:type><ts:syntax>1.3.6.1.4.1.1466.115.121.1.36</ts:syntax></ts:type>
        <ts:label>
            <ts:string xml:lang="en">Balance</ts:string>
            <ts:string xml:lang="zh">餘額</ts:string>
        </ts:label>
        <ts:origins>
            <ethereum:call function="balanceOf" contract="cREP" as="uint">
                <ts:data>
                    <ts:address ref="ownerAddress"/>
                </ts:data>
            </ethereum:call>
        </ts:origins>
    </ts:attribute>

    <ts:attribute name="supplyInterestRate">
        <ts:type><ts:syntax>1.3.6.1.4.1.1466.115.121.1.36</ts:syntax></ts:type>
        <ts:label>
            <ts:string xml:lang="en">Supply Interest Rate</ts:string>
        </ts:label>
        <ts:origins>
            <ethereum:call function="supplyRatePerBlock" contract="cREP" as="uint">
            </ethereum:call>
        </ts:origins>
    </ts:attribute>

</ts:token>
